{
  "schema": 1,
  "id": "battle-of-schuinshoogte",
  "kind": "event",
  "status": "active",
  "supersededBy": null,
  "aliases": [],
  "authors": [
    {
      "name": "Wikidata import (tools/import/wikidata.mjs)",
      "github": null
    }
  ],
  "license": "CC-BY-SA-4.0",
  "created": "2026-10-16",
  "revised": null,
  "origin": {
    "tool": "wikidata"
  },
  "review": {
    "status": "draft",
    "flags": [
      "imported-facts",
      "summary-from-lead",
      "a9-place",
      "filed-from-p361"
    ]
  },
  "wikidata": "Q1286274",
  "sitelinks": {
    "count": 10,
    "on": "2026-10-16"
  },
  "wikipedia": {
    "en": "Battle of Schuinshoogte"
  },
  "sources": [
    {
      "source": "wikidata",
      "locator": "Q1286274"
    },
    {
      "source": "wikipedia-en",
      "locator": "\"Battle of Schuinshoogte\", revision 1379907996"
    }
  ],
  "title": "Battle of Schuinshoogte",
  "summary": "The English Wikipedia article \"Battle of Schuinshoogte\", at revision 1379907996, opens: \"Battle of Schuinshoogte, also known as Battle of Ingogo, was fought north of Newcastle, KwaZulu-Natal, on 8 February 1881 during the First Boer War. General Sir George Pomeroy Colley's communications with Newcastle were under constant harassment by mounted Boer patrols under Commander J. D. Weilbach after the Boer victory at the Battle of Laing's Nek and as a result he planned to clear a path along the Newcastle–Mount Prospect road to better protect the British supply line, and receive fresh reinforcements he needed to bolster his ranks.\" That is the article's account and not yet this atlas's; nobody has read this record, and review.html is where somebody does. Wikidata item Q1286274, imported by tools/import/wikidata.mjs. The item's own description reads \"1881 battle during the First Boer War\". Everything here is copied from the item's own fields and nothing in it is this atlas's account of the thing: that is still to be written, and review.html is where somebody writes it.",
  "when": {
    "start": 1881,
    "end": 1881,
    "date": "1881-02-08"
  },
  "place": "ingogo",
  "region": null,
  "regionNote": null,
  "category": "war",
  "actors": [],
  "parent": "first-boer-war"
}
