{
  "schema": 1,
  "id": "2024-european-parliament-election-in-portugal",
  "kind": "event",
  "status": "retracted",
  "supersededBy": null,
  "aliases": [],
  "authors": [
    {
      "name": "Wikidata import (tools/import/wikidata.mjs)",
      "github": null
    }
  ],
  "license": "CC-BY-SA-4.0",
  "created": "2026-09-04",
  "revised": "2026-10-13",
  "origin": {
    "tool": "wikidata"
  },
  "retraction": {
    "on": "2026-09-04",
    "reason": "Retracted in M22: the European Parliament election of 9 June 2024 in Portugal. The atlas keeps the first exercise of an institution and the ballot at which it became a cycle, and it retracts the routine repetitions after them. The ninth European election is one of those. The only link available is the constitutional one the earlier records already carry. Revisit if a consequence is written."
  },
  "review": {
    "flags": [
      "imported-facts",
      "m22-retracted"
    ]
  },
  "wikidata": "Q114422643",
  "sitelinks": {
    "count": 8,
    "on": "2026-09-04"
  },
  "wikipedia": {
    "en": "2024 European Parliament election in Portugal",
    "pt": "Eleições europeias de 2024 (Portugal)"
  },
  "sources": [
    {
      "source": "wikidata",
      "locator": "Q114422643"
    }
  ],
  "title": "2024 European Parliament election in Portugal",
  "summary": "Wikidata item Q114422643, imported by tools/import/wikidata.mjs. The item's own description reads \"Portuguese European elections to Parliament in 2024\". Everything here is copied from the item's own fields and nothing in it is this atlas's account of the thing: that is still to be written, and review.html is where somebody writes it.",
  "when": {
    "start": 2024,
    "end": 2024,
    "date": "2024-06-09"
  },
  "place": null,
  "region": "europe",
  "category": "election",
  "actors": []
}
