{
  "schema": 1,
  "id": "battle-of-debe-wielkie",
  "kind": "event",
  "status": "active",
  "supersededBy": null,
  "aliases": [],
  "authors": [
    {
      "name": "Wikidata import (tools/import/wikidata.mjs)",
      "github": null
    }
  ],
  "license": "CC-BY-SA-4.0",
  "created": "2026-10-31",
  "revised": null,
  "origin": {
    "tool": "wikidata"
  },
  "review": {
    "status": "draft",
    "flags": [
      "imported-facts",
      "summary-from-lead",
      "a9-place",
      "filed-from-p361"
    ]
  },
  "wikidata": "Q2445578",
  "sitelinks": {
    "count": 7,
    "on": "2026-10-31"
  },
  "wikipedia": {
    "en": "Battle of Dębe Wielkie"
  },
  "sources": [
    {
      "source": "wikidata",
      "locator": "Q2445578"
    },
    {
      "source": "wikipedia-en",
      "locator": "\"Battle of Dębe Wielkie\", revision 1370439649"
    }
  ],
  "title": "Battle of Dębe Wielkie",
  "summary": "The English Wikipedia article \"Battle of Dębe Wielkie\", at revision 1370439649, opens: \"The Battle of Dębe Wielkie was fought on 17 March 1831. The Polish army, led by Jan Skrzynecki, won over Russian curtain forces commanded by General Geismar.\" That is the article's account and not yet this atlas's; nobody has read this record, and review.html is where somebody does. Wikidata item Q2445578, imported by tools/import/wikidata.mjs. The item's own description reads \"1831 battle of the Polish November Uprising\". Everything here is copied from the item's own fields and nothing in it is this atlas's account of the thing: that is still to be written, and review.html is where somebody writes it.",
  "when": {
    "start": 1831,
    "end": 1831,
    "date": "1831-03-30",
    "endDate": "1831-03-31"
  },
  "place": "poland-q36",
  "region": null,
  "regionNote": null,
  "category": "war",
  "actors": [],
  "parent": "november-uprising"
}
