{
  "schema": 1,
  "id": "siege-of-cuddalore",
  "kind": "event",
  "status": "active",
  "supersededBy": null,
  "aliases": [],
  "authors": [
    {
      "name": "Wikidata import (tools/import/wikidata.mjs)",
      "github": null
    }
  ],
  "license": "CC-BY-SA-4.0",
  "created": "2026-10-31",
  "revised": null,
  "origin": {
    "tool": "wikidata"
  },
  "review": {
    "status": "draft",
    "flags": [
      "imported-facts",
      "summary-from-lead",
      "filed-from-p361"
    ]
  },
  "wikidata": "Q12976096",
  "sitelinks": {
    "count": 5,
    "on": "2026-10-31"
  },
  "wikipedia": {
    "en": "Siege of Cuddalore"
  },
  "sources": [
    {
      "source": "wikidata",
      "locator": "Q12976096"
    },
    {
      "source": "wikipedia-en",
      "locator": "\"Siege of Cuddalore\", revision 1370740492"
    }
  ],
  "title": "Siege of Cuddalore",
  "summary": "The English Wikipedia article \"Siege of Cuddalore\", at revision 1370740492, opens: \"The siege of Cuddalore was a siege attempt by British troops against a combined French and Mysorean garrison at the fortress of Cuddalore in the Second Anglo-Mysore War. The siege ended when news arrived of a preliminary peace treaty between France and Britain.\" That is the article's account and not yet this atlas's; nobody has read this record, and review.html is where somebody does. Wikidata item Q12976096, imported by tools/import/wikidata.mjs. The item's own description reads \"1783 battle of the American Revolutionary War\". Everything here is copied from the item's own fields and nothing in it is this atlas's account of the thing: that is still to be written, and review.html is where somebody writes it.",
  "when": {
    "start": 1783,
    "end": 1783,
    "date": "1783-06-07",
    "endDate": "1783-07-25"
  },
  "place": "cuddalore",
  "region": null,
  "regionNote": null,
  "category": "war",
  "actors": [],
  "parent": "second-anglo-mysore-war"
}
