{
  "schema": 1,
  "id": "battle-of-delhi-1757",
  "kind": "event",
  "status": "active",
  "supersededBy": null,
  "aliases": [],
  "authors": [
    {
      "name": "Wikidata import (tools/import/wikidata.mjs)",
      "github": null
    }
  ],
  "license": "CC-BY-SA-4.0",
  "created": "2026-10-31",
  "revised": null,
  "origin": {
    "tool": "wikidata"
  },
  "review": {
    "status": "draft",
    "flags": [
      "imported-facts",
      "summary-from-lead",
      "a9-place"
    ]
  },
  "wikidata": "Q17016230",
  "sitelinks": {
    "count": 6,
    "on": "2026-10-31"
  },
  "wikipedia": {
    "en": "Battle of Delhi (1757)"
  },
  "sources": [
    {
      "source": "wikidata",
      "locator": "Q17016230"
    },
    {
      "source": "wikipedia-en",
      "locator": "\"Battle of Delhi (1757)\", revision 1373933360"
    }
  ],
  "title": "Battle of Delhi (1757)",
  "summary": "The English Wikipedia article \"Battle of Delhi (1757)\", at revision 1373933360, opens: \"The Battle of Delhi in 1757 also referred to as the Second Battle of Delhi, was fought on 11 August 1757 between the Maratha Confederacy under the command of Raghunath Rao and the Rohillas under the command of Najib-ud-Daula, who was under the Afghan suzerainty and simultaneously the \"Pay Master\" of what remained of the Mughal Army. By 1757, Delhi was ruled indirectly by the Marathas. The battle was waged by the Marathas for the control of Delhi, the Mughal capital which was invaded by Rohilla chief Najib-ud-Daula, as a consequence of the fourth invasion of India by Ahmad Shah Abdali.\" That is the article's account and not yet this atlas's; nobody has read this record, and review.html is where somebody does. Wikidata item Q17016230, imported by tools/import/wikidata.mjs. The item's own description reads \"1757 fought between the Maratha Empire and Rohilla Afghans\". Everything here is copied from the item's own fields and nothing in it is this atlas's account of the thing: that is still to be written, and review.html is where somebody writes it.",
  "when": {
    "start": 1757,
    "end": 1757,
    "date": "1757-08-11",
    "endDate": "1757-08"
  },
  "place": "red-fort",
  "region": null,
  "regionNote": null,
  "category": "war",
  "actors": []
}
