{
  "schema": 1,
  "id": "battle-of-genoa-1795",
  "kind": "event",
  "status": "active",
  "supersededBy": null,
  "aliases": [],
  "authors": [
    {
      "name": "Wikidata import (tools/import/wikidata.mjs)",
      "github": null
    }
  ],
  "license": "CC-BY-SA-4.0",
  "created": "2026-10-30",
  "revised": null,
  "origin": {
    "tool": "wikidata"
  },
  "review": {
    "status": "draft",
    "flags": [
      "imported-facts",
      "summary-from-lead",
      "a9-place",
      "filed-from-p361"
    ]
  },
  "wikidata": "Q338792",
  "sitelinks": {
    "count": 8,
    "on": "2026-10-30"
  },
  "wikipedia": {
    "en": "Battle of Genoa (1795)"
  },
  "sources": [
    {
      "source": "wikidata",
      "locator": "Q338792"
    },
    {
      "source": "wikipedia-en",
      "locator": "\"Battle of Genoa (1795)\", revision 1381019245"
    }
  ],
  "title": "Battle of Genoa (1795)",
  "summary": "The English Wikipedia article \"Battle of Genoa (1795)\", at revision 1381019245, opens: \"The Battle of Genoa was a fleet action fought between an Anglo-Neapolitan fleet and a French fleet on 13-14 March 1795 in the Gulf of Genoa during the Mediterranean campaign of 1793–1796. The French fleet was led by Counter-admiral Pierre Martin and comprised 13 ships of the line while the Anglo-Neapolitan fleet fleet, under Vice-Admiral of the Red William Hotham mustered 13 ships of the line. The battle ended with a minor Anglo-Neapolitan victory and the capture of two French ships of the line.\" That is the article's account and not yet this atlas's; nobody has read this record, and review.html is where somebody does. Wikidata item Q338792, imported by tools/import/wikidata.mjs. The item's own description reads \"naval battle fought on 14 March 1795 off the coast of Genoa\". Everything here is copied from the item's own fields and nothing in it is this atlas's account of the thing: that is still to be written, and review.html is where somebody writes it.",
  "when": {
    "start": 1795,
    "end": 1795,
    "date": "1795-03-13",
    "endDate": "1795-03-14"
  },
  "place": "gulf-of-genoa",
  "region": null,
  "regionNote": null,
  "category": "war",
  "actors": [],
  "parent": "french-revolutionary-wars"
}
