{
  "schema": 1,
  "id": "korean-war",
  "kind": "event",
  "status": "active",
  "supersededBy": null,
  "aliases": [],
  "authors": [
    {
      "name": "Wikidata import (tools/import/wikidata.mjs)",
      "github": null
    },
    {
      "name": "Claude (assistant draft, unreviewed)",
      "github": null
    }
  ],
  "license": "CC-BY-SA-4.0",
  "created": "2026-09-05",
  "revised": "2026-09-29",
  "review": {
    "status": "draft",
    "flags": [
      "imported-facts",
      "summary-drafted",
      "a9-place",
      "a15-category-from-p31"
    ]
  },
  "origin": {
    "tool": "wikidata"
  },
  "wikidata": "Q8663",
  "wikipedia": {
    "en": "Korean War",
    "pt": "Guerra da Coreia"
  },
  "sitelinks": {
    "count": 132,
    "on": "2026-09-05"
  },
  "sources": [
    {
      "source": "wikipedia-en",
      "locator": "\"Korean War\", revision 1371767674"
    },
    {
      "source": "wikipedia-pt",
      "locator": "\"Guerra da Coreia\", revision 72794630"
    },
    {
      "source": "wikidata",
      "locator": "Q8663"
    },
    {
      "source": "wikidata",
      "locator": "Q8663, P31 Q198"
    }
  ],
  "title": "Korean War",
  "summary": "North Korean forces crossed the thirty-eighth parallel on 25 June 1950; the United Nations, with the Soviet delegate absent from the Security Council, authorised a defence, and the war ran through four reversals — the Pusan perimeter, Inchon, the Chinese intervention at the Yalu, and two years of static fighting — to an armistice in July 1953 that restored almost exactly the line it had started on. Between two and three million Koreans died. It has never formally ended. Its effect outside Korea was to turn the Cold War into an armed confrontation with standing forces: NATO acquired an integrated command and a rearmament programme, and Portugal's new membership of it began to cost money.",
  "when": {
    "start": 1950,
    "end": 1953,
    "date": "1950-06-25",
    "endDate": "1953-07-27"
  },
  "place": "korea-strait",
  "region": "asia",
  "category": "war",
  "actors": [
    {
      "actor": "korea-people-s-republic-of",
      "role": "belligerent"
    },
    {
      "actor": "korea-republic-of",
      "role": "belligerent"
    },
    {
      "actor": "united-states-of-america",
      "role": "belligerent"
    },
    {
      "actor": "china",
      "role": "belligerent"
    },
    {
      "actor": "united-nations",
      "role": "belligerent"
    }
  ]
}
