{
  "schema": 1,
  "id": "battle-of-kinburn-1787",
  "kind": "event",
  "status": "active",
  "supersededBy": null,
  "aliases": [],
  "authors": [
    {
      "name": "Wikidata import (tools/import/wikidata.mjs)",
      "github": null
    }
  ],
  "license": "CC-BY-SA-4.0",
  "created": "2026-10-31",
  "revised": null,
  "origin": {
    "tool": "wikidata"
  },
  "review": {
    "status": "draft",
    "flags": [
      "imported-facts",
      "summary-from-lead",
      "filed-from-p361"
    ]
  },
  "wikidata": "Q2914954",
  "sitelinks": {
    "count": 10,
    "on": "2026-10-31"
  },
  "wikipedia": {
    "en": "Battle of Kinburn (1787)"
  },
  "sources": [
    {
      "source": "wikidata",
      "locator": "Q2914954"
    },
    {
      "source": "wikipedia-en",
      "locator": "\"Battle of Kinburn (1787)\", revision 1382459761"
    }
  ],
  "title": "Battle of Kinburn (1787)",
  "summary": "The English Wikipedia article \"Battle of Kinburn (1787)\", at revision 1382459761, opens: \"The storming or battle of Kinburn was fought on 11–12 OctoberN.S./30 September – 1 OctoberO.S. 1787 as part of the Russo-Turkish War (1787–1792). It ended in victory for the Russian army and naval forces.\" That is the article's account and not yet this atlas's; nobody has read this record, and review.html is where somebody does. Wikidata item Q2914954, imported by tools/import/wikidata.mjs. The item's own description reads \"1787 battle of the Russo-Turkish War of 1787–1792\". Everything here is copied from the item's own fields and nothing in it is this atlas's account of the thing: that is still to be written, and review.html is where somebody writes it.",
  "when": {
    "start": 1787,
    "end": 1787,
    "date": "1787-10-01"
  },
  "place": null,
  "region": "europe",
  "regionNote": "Lane written by the Wikidata import (derived from its own point): this event points at no place record, so the timeline has nothing else to go on.",
  "category": "war",
  "actors": [],
  "parent": "russo-turkish-war-1787-1792"
}
