{
  "schema": 1,
  "id": "siege-of-fort-zeelandia",
  "kind": "event",
  "status": "active",
  "supersededBy": null,
  "aliases": [],
  "authors": [
    {
      "name": "Wikidata import (tools/import/wikidata.mjs)",
      "github": null
    }
  ],
  "license": "CC-BY-SA-4.0",
  "created": "2026-10-17",
  "revised": null,
  "origin": {
    "tool": "wikidata"
  },
  "review": {
    "status": "draft",
    "flags": [
      "imported-facts",
      "summary-from-lead",
      "a9-place"
    ]
  },
  "wikidata": "Q697621",
  "sitelinks": {
    "count": 21,
    "on": "2026-10-17"
  },
  "wikipedia": {
    "en": "Siege of Fort Zeelandia",
    "pt": "Cerco do Forte Zeelândia"
  },
  "sources": [
    {
      "source": "wikidata",
      "locator": "Q697621"
    },
    {
      "source": "wikipedia-en",
      "locator": "\"Siege of Fort Zeelandia\", revision 1379982063"
    }
  ],
  "title": "Siege of Fort Zeelandia",
  "summary": "The English Wikipedia article \"Siege of Fort Zeelandia\", at revision 1379982063, opens: \"The siege of Fort Zeelandia of 1661–1662 ended the Dutch East India Company's rule over Taiwan and began the Kingdom of Tungning's rule over the island.\" That is the article's account and not yet this atlas's; nobody has read this record, and review.html is where somebody does. Wikidata item Q697621, imported by tools/import/wikidata.mjs. The item's own description reads \"1662 battle between Dutch East India Company and Koxinga's Ming Loyalists\". Everything here is copied from the item's own fields and nothing in it is this atlas's account of the thing: that is still to be written, and review.html is where somebody writes it.",
  "when": {
    "start": 1661,
    "end": 1662,
    "date": "1661-03-30",
    "endDate": "1662-02-01"
  },
  "place": "fort-zeelandia-taiwan",
  "region": null,
  "regionNote": null,
  "category": "war",
  "actors": []
}
