{
  "schema": 1,
  "id": "action-of-18-march-1748",
  "kind": "event",
  "status": "active",
  "supersededBy": null,
  "aliases": [],
  "authors": [
    {
      "name": "Wikidata import (tools/import/wikidata.mjs)",
      "github": null
    }
  ],
  "license": "CC-BY-SA-4.0",
  "created": "2026-10-29",
  "revised": null,
  "origin": {
    "tool": "wikidata"
  },
  "review": {
    "status": "draft",
    "flags": [
      "imported-facts",
      "summary-from-lead",
      "filed-from-p361"
    ]
  },
  "wikidata": "Q4677277",
  "sitelinks": {
    "count": 3,
    "on": "2026-10-29"
  },
  "wikipedia": {
    "en": "Action of 18 March 1748"
  },
  "sources": [
    {
      "source": "wikidata",
      "locator": "Q4677277"
    },
    {
      "source": "wikipedia-en",
      "locator": "\"Action of 18 March 1748\", revision 1370426107"
    }
  ],
  "title": "Action of 18 March 1748",
  "summary": "The English Wikipedia article \"Action of 18 March 1748\", at revision 1370426107, opens: \"The action of 18 March 1748 was a naval engagement during the War of Jenkins' Ear in which a fleet of six Royal Naval vessels captured a number of merchantman in a successful engagement against a Spanish convoy escorted by nine ships of the line and frigates.\" That is the article's account and not yet this atlas's; nobody has read this record, and review.html is where somebody does. Wikidata item Q4677277, imported by tools/import/wikidata.mjs. The item's own description reads \"1748 naval battle\". Everything here is copied from the item's own fields and nothing in it is this atlas's account of the thing: that is still to be written, and review.html is where somebody writes it.",
  "when": {
    "start": 1748,
    "end": 1748,
    "date": "1748-03-18"
  },
  "place": null,
  "region": "europe",
  "regionNote": "Lane written by the Wikidata import (derived from its own point): this event points at no place record, so the timeline has nothing else to go on.",
  "category": "war",
  "actors": [],
  "parent": "war-of-jenkins-ear"
}
