{
  "schema": 1,
  "id": "battle-of-bennington",
  "kind": "event",
  "status": "active",
  "supersededBy": null,
  "aliases": [],
  "authors": [
    {
      "name": "Wikidata import (tools/import/wikidata.mjs)",
      "github": null
    }
  ],
  "license": "CC-BY-SA-4.0",
  "created": "2026-09-30",
  "revised": null,
  "origin": {
    "tool": "wikidata"
  },
  "review": {
    "status": "draft",
    "flags": [
      "imported-facts",
      "summary-from-lead",
      "a9-place",
      "filed-from-p361"
    ]
  },
  "wikidata": "Q1754313",
  "sitelinks": {
    "count": 15,
    "on": "2026-09-30"
  },
  "wikipedia": {
    "en": "Battle of Bennington",
    "pt": "Batalha de Bennington"
  },
  "sources": [
    {
      "source": "wikidata",
      "locator": "Q1754313"
    },
    {
      "source": "wikipedia-en",
      "locator": "\"Battle of Bennington\", revision 1375222856"
    }
  ],
  "title": "Battle of Bennington",
  "summary": "The English Wikipedia article \"Battle of Bennington\", at revision 1375222856, opens: \"The Battle of Bennington was a battle of the American Revolutionary War, part of the Saratoga campaign, that took place on August 16, 1777, on the John Green farm in Walloomsac, New York, about 10 miles (16 km) from its namesake, Bennington, Vermont. An American force of 2,000 men, primarily New Hampshire and Massachusetts militiamen, led by General John Stark, and reinforced by militiamen from the independent Vermont Republic led by Colonel Seth Warner and members of the Green Mountain Boys, decisively defeated a detachment of General John Burgoyne's army led by Lieutenant-Colonel Friedrich Baum, and supported by additional troops under Lieutenant-Colonel Heinrich von Breymann.\" That is the article's account and not yet this atlas's; nobody has read this record, and review.html is where somebody does. Wikidata item Q1754313, imported by tools/import/wikidata.mjs. The item's own description reads \"1777 battle of the American Revolutionary War\". Everything here is copied from the item's own fields and nothing in it is this atlas's account of the thing: that is still to be written, and review.html is where somebody writes it.",
  "when": {
    "start": 1777,
    "end": 1777,
    "date": "1777-08-16"
  },
  "place": "bennington-vermont",
  "region": null,
  "regionNote": null,
  "category": "war",
  "actors": [],
  "parent": "american-revolutionary-war"
}
