{
  "schema": 1,
  "id": "battle-of-catlabuga",
  "kind": "event",
  "status": "active",
  "supersededBy": null,
  "aliases": [],
  "authors": [
    {
      "name": "Wikidata import (tools/import/wikidata.mjs)",
      "github": null
    }
  ],
  "license": "CC-BY-SA-4.0",
  "created": "2026-10-30",
  "revised": null,
  "origin": {
    "tool": "wikidata"
  },
  "review": {
    "status": "draft",
    "flags": [
      "imported-facts",
      "summary-from-lead",
      "filed-from-p361"
    ]
  },
  "wikidata": "Q2435832",
  "sitelinks": {
    "count": 7,
    "on": "2026-10-30"
  },
  "wikipedia": {
    "en": "Battle of Cătlăbuga"
  },
  "sources": [
    {
      "source": "wikidata",
      "locator": "Q2435832"
    },
    {
      "source": "wikipedia-en",
      "locator": "\"Battle of Cătlăbuga\", revision 1374923873"
    }
  ],
  "title": "Battle of Cătlăbuga",
  "summary": "The English Wikipedia article \"Battle of Cătlăbuga\", at revision 1374923873, opens: \"The Battle of Cătlăbuga was fought on November 16, 1485, between Stephen III of Moldavia and Ottoman forces defending the surroundings of Chilia. The Moldavian army came out victorious, but Stephen ceased attempting to regain Chilia.\" That is the article's account and not yet this atlas's; nobody has read this record, and review.html is where somebody does. Wikidata item Q2435832, imported by tools/import/wikidata.mjs. The item's own description reads \"1485 battle\". Everything here is copied from the item's own fields and nothing in it is this atlas's account of the thing: that is still to be written, and review.html is where somebody writes it.",
  "when": {
    "start": 1485,
    "end": 1485,
    "date": "1485-11-16"
  },
  "place": null,
  "region": "europe",
  "regionNote": "Lane written by the Wikidata import (derived from its own point): this event points at no place record, so the timeline has nothing else to go on.",
  "category": "war",
  "actors": [],
  "parent": "moldavian-ottoman-wars"
}
