{
  "schema": 1,
  "id": "battle-of-ashmyany",
  "kind": "event",
  "status": "active",
  "supersededBy": null,
  "aliases": [],
  "authors": [
    {
      "name": "Wikidata import (tools/import/wikidata.mjs)",
      "github": null
    }
  ],
  "license": "CC-BY-SA-4.0",
  "created": "2026-10-31",
  "revised": null,
  "origin": {
    "tool": "wikidata"
  },
  "review": {
    "status": "draft",
    "flags": [
      "imported-facts",
      "summary-from-lead",
      "filed-from-p361"
    ]
  },
  "wikidata": "Q3920896",
  "sitelinks": {
    "count": 6,
    "on": "2026-10-31"
  },
  "wikipedia": {
    "en": "Battle of Ashmyany"
  },
  "sources": [
    {
      "source": "wikidata",
      "locator": "Q3920896"
    },
    {
      "source": "wikipedia-en",
      "locator": "\"Battle of Ashmyany\", revision 1370107082"
    }
  ],
  "title": "Battle of Ashmyany",
  "summary": "The English Wikipedia article \"Battle of Ashmyany\", at revision 1370107082, opens: \"The Battle of Ashmyany or Ašmena was fought on 8 December 1432 at Ashmyany between the armies of Švitrigaila and Sigismund Kęstutaitis, two pretenders to the throne of the Grand Duchy of Lithuania during the Lithuanian Civil War (1432–1438).\" That is the article's account and not yet this atlas's; nobody has read this record, and review.html is where somebody does. Wikidata item Q3920896, imported by tools/import/wikidata.mjs. The item's own description reads \"1432 battle\". Everything here is copied from the item's own fields and nothing in it is this atlas's account of the thing: that is still to be written, and review.html is where somebody writes it.",
  "when": {
    "start": 1432,
    "end": 1432,
    "date": "1432-12-08"
  },
  "place": null,
  "region": "europe",
  "regionNote": "Lane written by the Wikidata import (derived from its own point): this event points at no place record, so the timeline has nothing else to go on.",
  "category": "war",
  "actors": [],
  "parent": "lithuanian-civil-war-1432-1438"
}
