{
  "schema": 1,
  "id": "battle-of-powder-river",
  "kind": "event",
  "status": "active",
  "supersededBy": null,
  "aliases": [],
  "authors": [
    {
      "name": "Wikidata import (tools/import/wikidata.mjs)",
      "github": null
    }
  ],
  "license": "CC-BY-SA-4.0",
  "created": "2026-11-01",
  "revised": null,
  "origin": {
    "tool": "wikidata"
  },
  "review": {
    "status": "draft",
    "flags": [
      "imported-facts",
      "summary-from-lead",
      "a9-place",
      "filed-from-p361"
    ]
  },
  "wikidata": "Q16898752",
  "sitelinks": {
    "count": 6,
    "on": "2026-11-01"
  },
  "wikipedia": {
    "en": "Battle of Powder River"
  },
  "sources": [
    {
      "source": "wikidata",
      "locator": "Q16898752"
    },
    {
      "source": "wikipedia-en",
      "locator": "\"Battle of Powder River\", revision 1381619365"
    }
  ],
  "title": "Battle of Powder River",
  "summary": "The English Wikipedia article \"Battle of Powder River\", at revision 1381619365, opens: \"The Battle of Powder River, also known as the Reynolds Battle, occurred on March 17, 1876, in Montana Territory, United States, as part of the Big Horn Expedition. The attack on a Northern Cheyenne and Oglala Lakota Indian encampment by Colonel Joseph J. Reynolds initiated the Great Sioux War of 1876. Although destroying a large amount of Indian property, the attack was poorly carried out and solidified Northern Cheyenne and Lakota Sioux resistance to the U.S. attempt to force them to sell the Black Hills and live on a reservation.\" That is the article's account and not yet this atlas's; nobody has read this record, and review.html is where somebody does. Wikidata item Q16898752, imported by tools/import/wikidata.mjs. The item's own description reads \"1876 military battle fought during the Black Hills War\". Everything here is copied from the item's own fields and nothing in it is this atlas's account of the thing: that is still to be written, and review.html is where somebody writes it.",
  "when": {
    "start": 1876,
    "end": 1876,
    "date": "1876-03-17"
  },
  "place": "powder-river-wyoming-and-montana",
  "region": null,
  "regionNote": null,
  "category": "war",
  "actors": [],
  "parent": "great-sioux-war-of-1876"
}
